{
  "schema_version": "2.2.0",
  "run_id": "11111111-1111-4111-8111-111111111111",
  "launch_id": "33333333-3333-4333-8333-333333333333",
  "receipt_id": "22222222-2222-4222-8222-222222222222",
  "step_id": "plan.research",
  "work_item_id": null,
  "agent": "codebase-researcher",
  "mode": "implementation",
  "config": { "role": "codebase-researcher" },
  "inputs": { "approved_ac_version": 1 },
  "allowed_writes": ["C:\\run\\staging\\33333333-3333-4333-8333-333333333333.craft.json"],
  "craft_staging_path": "C:\\run\\staging\\33333333-3333-4333-8333-333333333333.craft.json",
  "named_artifact_path": null,
  "contract_refs": [
    ".cursor/foundry/docs/worker-launch-contract.md",
    ".cursor/foundry/contracts/backend-builder.yaml",
    ".cursor/agents/codebase-researcher.md"
  ],
  "context_budget": { "max_input_chars": 16000, "max_summary_chars": 4000 },
  "prompt": "Run codebase-researcher in implementation mode and write craft-only JSON."
}
